{
  "schema_version": 1,
  "diagram_type": "architecture",
  "meta": {
    "title": "2つの操作と2つの識別子",
    "locale": "ja",
    "visual_preset": "editorial",
    "quality_profile": "showcase",
    "animation": "none",
    "viewBox": [
      740,
      580
    ]
  },
  "components": [
    {
      "id": "client",
      "label": "クライアント",
      "type": "frontend",
      "pos": [
        60,
        110
      ],
      "size": [
        190,
        76
      ]
    },
    {
      "id": "post",
      "label": "POST /jobs",
      "type": "backend",
      "pos": [
        420,
        110
      ],
      "size": [
        190,
        76
      ]
    },
    {
      "id": "get",
      "label": "GET /jobs/{jobId}",
      "type": "backend",
      "pos": [
        60,
        380
      ],
      "size": [
        190,
        76
      ]
    },
    {
      "id": "record",
      "label": "ジョブ記録",
      "type": "database",
      "pos": [
        420,
        380
      ],
      "size": [
        190,
        76
      ]
    }
  ],
  "connections": [
    {
      "id": "e0",
      "to": "post",
      "label": "imageId + requestKey",
      "from": "client"
    },
    {
      "id": "e1",
      "to": "record",
      "label": "同じキーは同じjobId",
      "from": "post",
      "labelAt": [
        515,
        280
      ]
    },
    {
      "id": "e2",
      "to": "get",
      "label": "jobIdで照会",
      "from": "client",
      "labelAt": [
        155,
        280
      ]
    },
    {
      "id": "e3",
      "to": "record",
      "label": "状態・結果を参照",
      "from": "get"
    }
  ]
}
